{
  "envelope_type": "signed_human_intent",
  "version": "0.1",
  "human_intent_id": "intent_market_research_001",
  "issuer": "user:alex",
  "subject_agent_id": "agent_researcher_01",
  "purpose": "buy_market_data_api_call",
  "causal_parent": "task_market_report_001",
  "allowed_asset": "USDC",
  "allowed_recipient": "market-data-api.example",
  "max_amount": "5.00",
  "budget_scope": "daily_research_budget",
  "payment_mode": "one_time",
  "issued_at": "2026-05-25T00:00:00Z",
  "expires_at": "2020-01-01T00:00:00Z",
  "nonce": "nonce_expired_001",
  "policy_version": "payment-policy-v0.1",
  "signature_alg": "demo-sha256-v0",
  "signature": "f7294eff8bf3bebafffd621072c0f73ce2f453a2e99149e21df225df2f62286c"
}
