{
  "envelope_type": "signed_human_intent",
  "version": "0.1",
  "human_intent_id": "intent_market_research_001",
  "issuer": "user:alex",
  "subject_agent_id": "agent_researcher_01",
  "purpose": "buy_market_data_api_call",
  "causal_parent": "task_market_report_001",
  "allowed_asset": "USDC",
  "allowed_recipient": "market-data-api.example",
  "max_amount": "5.00",
  "budget_scope": "daily_research_budget",
  "payment_mode": "recurring",
  "issued_at": "2026-05-25T00:00:00Z",
  "expires_at": "2099-01-01T00:00:00Z",
  "nonce": "nonce_market_research_mode_mismatch",
  "policy_version": "payment-policy-v0.1",
  "signature_alg": "demo-sha256-v0",
  "signature": "8afa7f77f68a01e3f511eb300c4b7da321c0665e795de8ca25f586f79ede75ba"
}
